{
  "environment_allowlist": [
    "PATH"
  ],
  "expected_exit_code": 0,
  "expected_exit_code_class": "exact",
  "locale": "C.UTF-8",
  "native": {
    "argv": [
      "python3",
      "-m",
      "doctest",
      "-v",
      "fixture/textutil.py"
    ],
    "cwd": ".",
    "stdin_path": null
  },
  "network_policy": "disabled",
  "rtk": {
    "argv": [
      "rtk",
      "pipe",
      "--passthrough"
    ]
  },
  "source_date_epoch": 1700000000,
  "timeout_s": 60,
  "timezone": "UTC"
}
