{
  "native": {
    "argv": ["python3", "fixture/demo_tool.py"],
    "cwd": ".",
    "stdin_path": null
  },
  "rtk": {
    "argv": ["rtk", "pipe", "--filter", "log"]
  },
  "environment_allowlist": ["PATH"],
  "expected_exit_code_class": "exact",
  "expected_exit_code": 3,
  "timeout_s": 30,
  "network_policy": "disabled",
  "locale": "C.UTF-8",
  "timezone": "UTC",
  "source_date_epoch": 1700000000
}
